Protein id	Contig id	Start	Stop	Strand	Element symbol	Element name	Scope	Type	Subtype	Class	Subclass	Method	Target length	Reference sequence length	% Coverage of reference	% Identity to reference	Alignment length	Closest reference accession	Closest reference name	HMM accession	HMM description
NA	accn|562.100023.con.0001	171843	173567	-	ptsI_V25I	Escherichia fosfomycin resistant PtsI	core	AMR	POINT	FOSFOMYCIN	FOSFOMYCIN	POINTX	575	575	100.00	99.65	575	WP_000623140.1	phosphoenolpyruvate--protein phosphotransferase PtsI	NA	NA
NA	accn|562.100023.con.0001	360909	363533	+	gyrA_D87N	Escherichia quinolone resistant GyrA	core	AMR	POINT	QUINOLONE	QUINOLONE	POINTX	875	878	99.66	98.86	875	WP_001281243.1	DNA gyrase subunit A GyrA	NA	NA
NA	accn|562.100023.con.0001	360909	363533	+	gyrA_S83L	Escherichia quinolone resistant GyrA	core	AMR	POINT	QUINOLONE	QUINOLONE	POINTX	875	878	99.66	98.86	875	WP_001281243.1	DNA gyrase subunit A GyrA	NA	NA
NA	accn|562.100023.con.0001	387580	388699	+	ompC_K304TerfsTer0	Escherichia carbapenem resistant OmpC	core	AMR	POINT_DISRUPT	BETA-LACTAM	CARBAPENEM	POINTX	373	367	100.00	91.51	377	WP_000865568.1	outer membrane porin C OmpC	NA	NA
NA	accn|562.100023.con.0006	41052	41696	-	acrR_E67Ter	Escherichia ampicillin/chloramphenicol/fluoroquinolone/rifampin/tetracycline resistant AcrR	core	AMR	POINT_DISRUPT	MULTIDRUG	AMPICILLIN/CHLORAMPHENICOL/FLUOROQUINOLONE/RIFAMPIN/TETRACYCLINE	POINTX	215	215	100.00	99.53	215	WP_000101737.1	transcriptional regulator AcrR	NA	NA
NA	accn|562.100023.con.0007	172310	173698	-	uhpT_E350Q	Escherichia fosfomycin resistant UhpT	core	AMR	POINT	FOSFOMYCIN	FOSFOMYCIN	POINTX	463	463	100.00	99.78	463	WP_000879194.1	hexose phosphate transporter UhpT	NA	NA
NA	accn|562.100023.con.0009	100314	102569	-	parC_E84V	Escherichia quinolone resistant ParC	core	AMR	POINT	QUINOLONE	QUINOLONE	POINTX	752	752	100.00	99.20	752	WP_001281881.1	DNA topoisomerase IV subunit A ParC	NA	NA
NA	accn|562.100023.con.0009	100314	102569	-	parC_S80I	Escherichia quinolone resistant ParC	core	AMR	POINT	QUINOLONE	QUINOLONE	POINTX	752	752	100.00	99.20	752	WP_001281881.1	DNA topoisomerase IV subunit A ParC	NA	NA
NA	accn|562.100023.con.0009	117565	119454	-	parE_I529L	Escherichia quinolone resistant ParE	core	AMR	POINT	QUINOLONE	QUINOLONE	POINTX	630	630	100.00	99.52	630	WP_033554192.1	DNA topoisomerase IV subunit B ParE	NA	NA
NA	accn|562.100023.con.0031	2070	3266	+	tet(A)	tetracycline efflux MFS transporter Tet(A)	core	AMR	AMR	TETRACYCLINE	TETRACYCLINE	EXACTX	399	399	100.00	100.00	399	WP_000804064.1	tetracycline efflux MFS transporter Tet(A)	NA	NA
NA	accn|562.100023.con.0041	1488	1958	+	dfrA17	trimethoprim-resistant dihydrofolate reductase DfrA17	core	AMR	AMR	TRIMETHOPRIM	TRIMETHOPRIM	EXACTX	157	157	100.00	100.00	157	WP_001389366.1	trimethoprim-resistant dihydrofolate reductase DfrA17	NA	NA
NA	accn|562.100023.con.0041	2092	2877	+	aadA5	ANT(3'')-Ia family aminoglycoside nucleotidyltransferase AadA5	core	AMR	AMR	AMINOGLYCOSIDE	STREPTOMYCIN	EXACTX	262	262	100.00	100.00	262	WP_000503573.1	ANT(3'')-Ia family aminoglycoside nucleotidyltransferase AadA5	NA	NA
NA	accn|562.100023.con.0041	3086	3430	+	qacEdelta1	quaternary ammonium compound efflux SMR transporter QacE delta 1	core	STRESS	BIOCIDE	QUATERNARY AMMONIUM	QUATERNARY AMMONIUM	ALLELEX	115	115	100.00	100.00	115	WP_000679427.1	quaternary ammonium compound efflux SMR transporter QacE delta 1	NA	NA
NA	accn|562.100023.con.0041	3427	4263	+	sul1	sulfonamide-resistant dihydropteroate synthase Sul1	core	AMR	AMR	SULFONAMIDE	SULFONAMIDE	EXACTX	279	279	100.00	100.00	279	WP_000259031.1	sulfonamide-resistant dihydropteroate synthase Sul1	NA	NA
NA	accn|562.100023.con.0041	8345	9580	-	mrx(A)	phosphorylated macrolide efflux MFS transporter Mrx(A)	core	AMR	AMR	MACROLIDE	AZITHROMYCIN/ERYTHROMYCIN/SPIRAMYCIN/TELITHROMYCIN	EXACTX	412	412	100.00	100.00	412	WP_000004159.1	phosphorylated macrolide efflux MFS transporter Mrx(A)	NA	NA
NA	accn|562.100023.con.0041	9580	10482	-	mph(A)	Mph(A) family macrolide 2'-phosphotransferase	core	AMR	AMR	MACROLIDE	AZITHROMYCIN/ERYTHROMYCIN/SPIRAMYCIN/TELITHROMYCIN	EXACTX	301	301	100.00	100.00	301	WP_000219391.1	Mph(A) family macrolide 2'-phosphotransferase	NA	NA
NA	accn|562.100023.con.0046	958	1815	+	blaTEM-1	broad-spectrum class A beta-lactamase TEM-1	core	AMR	AMR	BETA-LACTAM	BETA-LACTAM	ALLELEX	286	286	100.00	100.00	286	WP_000027057.1	broad-spectrum class A beta-lactamase TEM-1	NA	NA
NA	accn|562.100023.con.0062	44	901	+	aac(3)-IIe	aminoglycoside N-acetyltransferase AAC(3)-IIe	core	AMR	AMR	AMINOGLYCOSIDE	GENTAMICIN	EXACTX	286	286	100.00	100.00	286	WP_000557452.1	aminoglycoside N-acetyltransferase AAC(3)-IIe	NA	NA
NA	accn|562.100023.con.0067	92	643	+	aac(6')-Ib-cr5	fluoroquinolone-acetylating aminoglycoside 6'-N-acetyltransferase AAC(6')-Ib-cr5	core	AMR	AMR	AMINOGLYCOSIDE/QUINOLONE	AMIKACIN/KANAMYCIN/QUINOLONE/TOBRAMYCIN	ALLELEX	184	184	100.00	100.00	184	WP_063840321.1	fluoroquinolone-acetylating aminoglycoside 6'-N-acetyltransferase AAC(6')-Ib-cr5	NA	NA
NA	accn|562.100023.con.0067	777	1604	+	blaOXA-1	oxacillin-hydrolyzing class D beta-lactamase OXA-1	core	AMR	AMR	BETA-LACTAM	CEPHALOSPORIN	ALLELEX	276	276	100.00	100.00	276	WP_001334766.1	oxacillin-hydrolyzing class D beta-lactamase OXA-1	NA	NA
NA	accn|562.100023.con.0067	1745	2185	+	catB3	type B-3 chloramphenicol O-acetyltransferase CatB3	core	AMR	AMR	PHENICOL	CHLORAMPHENICOL	PARTIAL_CONTIG_ENDX	147	210	70.00	100.00	147	WP_000186237.1	type B-3 chloramphenicol O-acetyltransferase CatB3	NA	NA
NA	accn|562.100023.con.0077	395	1267	-	blaCTX-M-15	extended-spectrum class A beta-lactamase CTX-M-15	core	AMR	AMR	BETA-LACTAM	CEPHALOSPORIN	ALLELEX	291	291	100.00	100.00	291	WP_000239590.1	extended-spectrum class A beta-lactamase CTX-M-15	NA	NA
